[
  {
    "detected_at": "2026-02-22T14:07:19.818909+00:00",
    "venue": "binance",
    "symbol": "ADA/USDT",
    "base": "ADA",
    "quote": "USDT",
    "spot_bid_price": 0.2727,
    "spot_ask_price": 0.2728,
    "spot_mid_price": 0.27275,
    "perp_bid_price": 0.2725,
    "perp_ask_price": 0.2725,
    "perp_mark_price": 0.2725,
    "perp_index_price": 0.27262534,
    "funding_rate": -0.00014395,
    "funding_rate_bps": -1.4395,
    "basis_mark_to_spot_bps": -9.165903,
    "basis_index_to_spot_bps": -4.570486,
    "next_funding_time": "2026-02-22T16:00:00+00:00",
    "minutes_to_funding": 112.6697
  },
  {
    "detected_at": "2026-02-22T14:07:19.818909+00:00",
    "venue": "binance",
    "symbol": "AVAX/USDT",
    "base": "AVAX",
    "quote": "USDT",
    "spot_bid_price": 8.89,
    "spot_ask_price": 8.9,
    "spot_mid_price": 8.895,
    "perp_bid_price": 8.89320526,
    "perp_ask_price": 8.89320526,
    "perp_mark_price": 8.89320526,
    "perp_index_price": 8.90002133,
    "funding_rate": -1.956e-05,
    "funding_rate_bps": -0.1956,
    "basis_mark_to_spot_bps": -2.017695,
    "basis_index_to_spot_bps": 5.645115,
    "next_funding_time": "2026-02-22T16:00:00+00:00",
    "minutes_to_funding": 112.6697
  },
  {
    "detected_at": "2026-02-22T14:07:19.818909+00:00",
    "venue": "binance",
    "symbol": "BNB/USDT",
    "base": "BNB",
    "quote": "USDT",
    "spot_bid_price": 618.9,
    "spot_ask_price": 618.91,
    "spot_mid_price": 618.905,
    "perp_bid_price": 619.03482071,
    "perp_ask_price": 619.03482071,
    "perp_mark_price": 619.03482071,
    "perp_index_price": 618.85481753,
    "funding_rate": 0.0,
    "funding_rate_bps": 0.0,
    "basis_mark_to_spot_bps": 2.097587,
    "basis_index_to_spot_bps": -0.810827,
    "next_funding_time": "2026-02-22T16:00:00+00:00",
    "minutes_to_funding": 112.6697
  },
  {
    "detected_at": "2026-02-22T14:07:19.818909+00:00",
    "venue": "binance",
    "symbol": "BTC/USDT",
    "base": "BTC",
    "quote": "USDT",
    "spot_bid_price": 67577.07,
    "spot_ask_price": 67577.08,
    "spot_mid_price": 67577.075,
    "perp_bid_price": 67548.0,
    "perp_ask_price": 67548.0,
    "perp_mark_price": 67548.0,
    "perp_index_price": 67565.83478261,
    "funding_rate": 2.665e-05,
    "funding_rate_bps": 0.2665,
    "basis_mark_to_spot_bps": -4.302495,
    "basis_index_to_spot_bps": -1.663318,
    "next_funding_time": "2026-02-22T16:00:00+00:00",
    "minutes_to_funding": 112.6697
  },
  {
    "detected_at": "2026-02-22T14:07:19.818909+00:00",
    "venue": "binance",
    "symbol": "DOGE/USDT",
    "base": "DOGE",
    "quote": "USDT",
    "spot_bid_price": 0.0959,
    "spot_ask_price": 0.09591,
    "spot_mid_price": 0.095905,
    "perp_bid_price": 0.09584,
    "perp_ask_price": 0.09584,
    "perp_mark_price": 0.09584,
    "perp_index_price": 0.09589927,
    "funding_rate": -9.74e-05,
    "funding_rate_bps": -0.974,
    "basis_mark_to_spot_bps": -6.77754,
    "basis_index_to_spot_bps": -0.597466,
    "next_funding_time": "2026-02-22T16:00:00+00:00",
    "minutes_to_funding": 112.6697
  },
  {
    "detected_at": "2026-02-22T14:07:19.818909+00:00",
    "venue": "binance",
    "symbol": "ETH/USDT",
    "base": "ETH",
    "quote": "USDT",
    "spot_bid_price": 1947.35,
    "spot_ask_price": 1947.36,
    "spot_mid_price": 1947.355,
    "perp_bid_price": 1946.25,
    "perp_ask_price": 1946.25,
    "perp_mark_price": 1946.25,
    "perp_index_price": 1946.97372093,
    "funding_rate": -1.056e-05,
    "funding_rate_bps": -0.1056,
    "basis_mark_to_spot_bps": -5.674363,
    "basis_index_to_spot_bps": -1.957933,
    "next_funding_time": "2026-02-22T16:00:00+00:00",
    "minutes_to_funding": 112.6697
  },
  {
    "detected_at": "2026-02-22T14:07:19.818909+00:00",
    "venue": "binance",
    "symbol": "LINK/USDT",
    "base": "LINK",
    "quote": "USDT",
    "spot_bid_price": 8.71,
    "spot_ask_price": 8.72,
    "spot_mid_price": 8.715,
    "perp_bid_price": 8.709,
    "perp_ask_price": 8.709,
    "perp_mark_price": 8.709,
    "perp_index_price": 8.71164334,
    "funding_rate": -8.296e-05,
    "funding_rate_bps": -0.8296,
    "basis_mark_to_spot_bps": -6.884682,
    "basis_index_to_spot_bps": -3.851589,
    "next_funding_time": "2026-02-22T16:00:00+00:00",
    "minutes_to_funding": 112.6697
  },
  {
    "detected_at": "2026-02-22T14:07:19.818909+00:00",
    "venue": "binance",
    "symbol": "LTC/USDT",
    "base": "LTC",
    "quote": "USDT",
    "spot_bid_price": 53.31,
    "spot_ask_price": 53.32,
    "spot_mid_price": 53.315,
    "perp_bid_price": 53.29,
    "perp_ask_price": 53.29,
    "perp_mark_price": 53.29,
    "perp_index_price": 53.31058824,
    "funding_rate": -6.785e-05,
    "funding_rate_bps": -0.6785,
    "basis_mark_to_spot_bps": -4.689112,
    "basis_index_to_spot_bps": -0.827489,
    "next_funding_time": "2026-02-22T16:00:00+00:00",
    "minutes_to_funding": 112.6697
  },
  {
    "detected_at": "2026-02-22T14:07:19.818909+00:00",
    "venue": "binance",
    "symbol": "SOL/USDT",
    "base": "SOL",
    "quote": "USDT",
    "spot_bid_price": 83.72,
    "spot_ask_price": 83.73,
    "spot_mid_price": 83.725,
    "perp_bid_price": 83.69,
    "perp_ask_price": 83.69,
    "perp_mark_price": 83.69,
    "perp_index_price": 83.71779384,
    "funding_rate": -9.482e-05,
    "funding_rate_bps": -0.9482,
    "basis_mark_to_spot_bps": -4.180352,
    "basis_index_to_spot_bps": -0.860694,
    "next_funding_time": "2026-02-22T16:00:00+00:00",
    "minutes_to_funding": 112.6697
  },
  {
    "detected_at": "2026-02-22T14:07:19.818909+00:00",
    "venue": "binance",
    "symbol": "XRP/USDT",
    "base": "XRP",
    "quote": "USDT",
    "spot_bid_price": 1.3987,
    "spot_ask_price": 1.3988,
    "spot_mid_price": 1.39875,
    "perp_bid_price": 1.3979,
    "perp_ask_price": 1.3979,
    "perp_mark_price": 1.3979,
    "perp_index_price": 1.39836562,
    "funding_rate": -0.0001312,
    "funding_rate_bps": -1.312,
    "basis_mark_to_spot_bps": -6.076854,
    "basis_index_to_spot_bps": -2.748025,
    "next_funding_time": "2026-02-22T16:00:00+00:00",
    "minutes_to_funding": 112.6697
  },
  {
    "detected_at": "2026-02-22T14:07:19.818909+00:00",
    "venue": "bybit",
    "symbol": "ADA/USDT",
    "base": "ADA",
    "quote": "USDT",
    "spot_bid_price": 0.2727,
    "spot_ask_price": 0.2728,
    "spot_mid_price": 0.27275,
    "perp_bid_price": 0.2725,
    "perp_ask_price": 0.2726,
    "perp_mark_price": 0.2726,
    "perp_index_price": 0.2727,
    "funding_rate": -8.646e-05,
    "funding_rate_bps": -0.8646,
    "basis_mark_to_spot_bps": -5.499542,
    "basis_index_to_spot_bps": -1.833181,
    "next_funding_time": "2026-02-22T16:00:00+00:00",
    "minutes_to_funding": 112.6697
  },
  {
    "detected_at": "2026-02-22T14:07:19.818909+00:00",
    "venue": "bybit",
    "symbol": "AVAX/USDT",
    "base": "AVAX",
    "quote": "USDT",
    "spot_bid_price": 8.89,
    "spot_ask_price": 8.9,
    "spot_mid_price": 8.895,
    "perp_bid_price": 8.892,
    "perp_ask_price": 8.893,
    "perp_mark_price": 8.894,
    "perp_index_price": 8.895,
    "funding_rate": 3.981e-05,
    "funding_rate_bps": 0.3981,
    "basis_mark_to_spot_bps": -1.124227,
    "basis_index_to_spot_bps": 0.0,
    "next_funding_time": "2026-02-22T16:00:00+00:00",
    "minutes_to_funding": 112.6697
  },
  {
    "detected_at": "2026-02-22T14:07:19.818909+00:00",
    "venue": "bybit",
    "symbol": "BNB/USDT",
    "base": "BNB",
    "quote": "USDT",
    "spot_bid_price": 619.0,
    "spot_ask_price": 619.1,
    "spot_mid_price": 619.05,
    "perp_bid_price": 618.5,
    "perp_ask_price": 618.6,
    "perp_mark_price": 618.5,
    "perp_index_price": 618.88,
    "funding_rate": 8.095e-05,
    "funding_rate_bps": 0.8095,
    "basis_mark_to_spot_bps": -8.884581,
    "basis_index_to_spot_bps": -2.746143,
    "next_funding_time": "2026-02-22T16:00:00+00:00",
    "minutes_to_funding": 112.6697
  },
  {
    "detected_at": "2026-02-22T14:07:19.818909+00:00",
    "venue": "bybit",
    "symbol": "BTC/USDT",
    "base": "BTC",
    "quote": "USDT",
    "spot_bid_price": 67569.2,
    "spot_ask_price": 67569.3,
    "spot_mid_price": 67569.25,
    "perp_bid_price": 67541.9,
    "perp_ask_price": 67542.0,
    "perp_mark_price": 67541.4,
    "perp_index_price": 67574.6,
    "funding_rate": -1.433e-05,
    "funding_rate_bps": -0.1433,
    "basis_mark_to_spot_bps": -4.121697,
    "basis_index_to_spot_bps": 0.79178,
    "next_funding_time": "2026-02-22T16:00:00+00:00",
    "minutes_to_funding": 112.6697
  },
  {
    "detected_at": "2026-02-22T14:07:19.818909+00:00",
    "venue": "bybit",
    "symbol": "DOGE/USDT",
    "base": "DOGE",
    "quote": "USDT",
    "spot_bid_price": 0.09592,
    "spot_ask_price": 0.09593,
    "spot_mid_price": 0.095925,
    "perp_bid_price": 0.09586,
    "perp_ask_price": 0.09587,
    "perp_mark_price": 0.09586,
    "perp_index_price": 0.0959,
    "funding_rate": -3.506e-05,
    "funding_rate_bps": -0.3506,
    "basis_mark_to_spot_bps": -6.776127,
    "basis_index_to_spot_bps": -2.606203,
    "next_funding_time": "2026-02-22T16:00:00+00:00",
    "minutes_to_funding": 112.6697
  },
  {
    "detected_at": "2026-02-22T14:07:19.818909+00:00",
    "venue": "bybit",
    "symbol": "ETH/USDT",
    "base": "ETH",
    "quote": "USDT",
    "spot_bid_price": 1947.52,
    "spot_ask_price": 1947.53,
    "spot_mid_price": 1947.525,
    "perp_bid_price": 1946.51,
    "perp_ask_price": 1946.52,
    "perp_mark_price": 1946.36,
    "perp_index_price": 1947.57,
    "funding_rate": -3.201e-05,
    "funding_rate_bps": -0.3201,
    "basis_mark_to_spot_bps": -5.981951,
    "basis_index_to_spot_bps": 0.231063,
    "next_funding_time": "2026-02-22T16:00:00+00:00",
    "minutes_to_funding": 112.6697
  },
  {
    "detected_at": "2026-02-22T14:07:19.818909+00:00",
    "venue": "bybit",
    "symbol": "LINK/USDT",
    "base": "LINK",
    "quote": "USDT",
    "spot_bid_price": 8.71,
    "spot_ask_price": 8.72,
    "spot_mid_price": 8.715,
    "perp_bid_price": 8.71,